,isEdited,developerResponse,rating,date,userName,title,review,country
898,False,,5,2015-06-28 20:07:00,Melegpedraz,La bomba,Me parece muy buena idea para salir de la rutina,ES
899,False,,5,2015-06-28 20:02:29,Pompasrosasdejabon,️Mola,Es la pera limonera!,ES
900,False,,5,2015-06-28 19:59:12,Claucoconut,Fever,Es una app súper fácil de utilizar y rápida de descargar. Los planes que propone son súper variados y apetecibles!,ES
901,False,,5,2015-06-28 19:21:21,Anabese1792,Fever,Muy buena,ES
902,False,,5,2015-06-28 16:08:35,RodolfoHoudini,Gracias Marc,"Marc Barcelo, gran rrpp mejor persona",ES
903,False,,1,2015-06-28 17:41:12,Alvarorj56483,Una vergüenza,"Planes caros, sin códigos no vale para nada. Han quitado el dinero de la gente por codigos que ellos han proporcionado.",ES
904,False,,1,2015-06-28 16:24:27,Merche_14,No sirve para nada,Te dan cupones gratis y luego te los quitan sin avisar,ES
905,False,,5,2015-06-28 15:57:39,Jrgcb91,F,Muy bueno!,ES
906,False,,5,2015-06-28 15:44:19,rafamcontel,Genial,Buenísima la App!,ES
907,False,,5,2015-06-28 15:31:57,Podoll23,Buena app,Es genial y muy completa! ;),ES
908,False,,5,2015-06-28 15:21:29,Jorchfeveradict,Increible!,"Fever es lo mejor que he probado. Estaré eternamente agradecido a AZAFATA71 por haberme abierto un mundo de posibilidades!

Me marean tantas actividades!!",ES
909,False,,1,2015-06-28 15:28:57,Patricosadeagua,Ciao,Os vais a hundir en la miseria,ES
910,False,,5,2015-06-28 15:19:59,Orizio8,Gran app,Siempre hay algo que hacer! 100% recomendado,ES
911,False,,5,2015-06-28 15:15:39,Cachitass,Súper útil,Muy buena aplicación con planes muy interesantes,ES
912,False,,5,2015-06-28 14:55:50,Pliars,Muy buena,Una aplicación muy útil,ES
913,False,,5,2015-06-28 14:36:21,Drackons,Guay,Apli muy chula,ES
914,False,,5,2015-06-27 17:47:05,byDieegoBz,Gran aplicación,Buena aplicación muy útil con planes muy económicos por Madrid,ES
915,False,,1,2015-06-28 08:57:35,Jfmd01,Ahorras dinero en la App y luego te lo roban,Después de estar ahorrando dinero para celebrar fin de exámenes van y nos dejan a 0€... Esto me suena a pan para hoy hambre para mañana!,ES
916,False,,1,2015-06-27 18:41:42,Edu946,Lamentable,Lamentable servicio,ES
917,False,,1,2015-06-27 18:35:44,MaríaJ.,ESTAFA,"Te quitan el dinero de los códigos ÍNTEGRO, así sin más",ES
918,False,,5,2015-06-27 17:43:17,Lydia illana,Buena aplicacion,"Buena aplicacion,planes baratos por Madrid y entretenidos.",ES
919,False,,1,2015-06-27 12:20:21,Guisopo,#Feverestafadores,"Dan códigos para uso y disfrute de la aplicación y sin venir a cuento los eliminan, estafa.",ES
920,False,,5,2015-06-26 23:43:27,Emprendedor30,De las mejores aplicaciones que puedes tener,"Es una pasada yo y mis amigos la utilizamos siempre, siempre nos sorprenden con sus actualizaciones.",ES
921,False,,1,2015-06-27 10:16:14,Lidiokaina,Estafa,Planes más caros de lo normal y además incompetentes ante sus propios errores. No lo recomiendo,ES
922,False,,1,2015-06-27 10:12:16,Troumb,Estafa,"He comprado varios planes y me han cancelado el saldo por uso indebido de la cuenta y por usar cupones no permitidos??
Empresa nada seria, cuidado.

#FeverEstafa",ES
923,False,,1,2015-06-27 08:51:49,JanitoD,Fever is dead,Problemas con los cobros y los códigos #feverestafa,ES
924,False,,5,2015-06-26 03:13:09,mellao1,ANGELL258 15€ de bono,Introduce este codigo ANGELL258,ES
925,False,,1,2015-06-26 21:55:22,Froz1984,Estafa,"Menuda estafa! Te quitan el saldo por un error suyo y encima te acusan de fraudulento. Y si estoy viajando a otras ciudades? En vez de solucionar el error haciendo que no se pueda cambiar de ciudad o geolocalizando, quitan todo el dinero a todo el mundo, incluso el conseguido con referidos y cancelan los planes. Bien se nota que los CEO son unos niñatillos de papa.",ES
926,False,,1,2015-06-26 20:41:12,Jsjndidndjdndudjdjd,Roban dinero,Roban el dinero,ES
927,False,,1,2015-06-26 19:49:56,Hectoritocom,With the face,Muy mala un fraude,ES
928,False,,1,2015-06-26 18:45:11,elmejordeivan,SE UNDEN,"si siguen así se van a quedar sin nadie.
una vergüenza de aplicación e inútil",ES
929,False,,1,2015-06-26 18:23:39,sam_bell,Lamentable,"Inventan con condiciones que no existen y te quitan planes que has comprado con tu dinero.
Timo de app.",ES
930,False,,1,2015-06-26 17:09:12,AntonioCuesta,Estafadores,Te quitan todo el dinero,ES
931,False,,1,2015-06-26 15:34:54,Urdi92,Estafa,"Cancelación del wallet, por supuesto uso indebido de códigos...en fin #FEVERESTAFA",ES
932,False,,1,2015-06-26 11:48:57,Landus1234566779,Estafa,Te quitan el saldo si viajas a otra ciudad,ES
933,False,,1,2015-06-26 09:44:59,Hgfggjgrhfsegjjojg,Lamentable,"Hacen lo que quieren con los usuarios, la atención al cliente es muy mala y se pasan los términos legales por donde les parece cambiándolos a su antojo.",ES
934,False,,1,2015-06-26 09:39:29,ESTAFADOXFEVER,ESTAFA,"Publicidad engañosa, haces lo que te dicen para expandir su App y luego no cumplen las condiciones. Nada recomendable.",ES
935,False,,1,2015-06-26 09:15:01,Pedroxiri,Cero,No vale para nada,ES
936,False,,1,2015-06-26 08:37:12,Mojagar92,Timo,"Es un timo! Nos han quitado el dinero y entradas que teníamos compradas sin ningún tipo de aviso porque dicen que eran cupones ilegales, en ningún sitio de su política de condiciones pone que es ilegal o un abuso la utilización de estos cupones. El abuso o la ilegalidad ha sido por parte de ellos al no avisar de la retirada del dinero y de las entradas.",ES
937,False,,1,2015-06-26 07:40:30,Danielo86,Inutil,"Los planes cuestan igual que si lo haces por tu cuenta. No te dejan opinar, ni se preocupan de que tal son los planes. He comprado dos y han sido un absoluto desastre. Para colmo proporcionan codigos promocionales y luego le quitan el dinero a los usuarios aludiendo uso fraudulento. Desastre absoluto y decepcion.",ES
938,False,,1,2015-06-26 00:30:33,Vitejo,Apesta,Te quitan el dinero por problemas suyos,ES
939,False,,1,2015-06-25 23:37:03,KuchaLiu,Estafa,"Es una vergüenza,quitando el credito a los clientes.Si fué un error,no pongais la aplicación para descargar.Ahora me habeis quitado el plan del fin de semana sin vergüenzas.Estafa total.",ES
940,False,,5,2015-06-25 20:54:30,Begolop,Adiós fever,Malísima han quitado el saldo a todo el mundo,ES
941,False,,1,2015-06-25 23:29:36,Pampam99999999,Estafa fever,Tenia 45€ y por un error suyo me lo han quitado sin sentido.,ES
942,False,,1,2015-06-25 23:14:10,No es de fiar,Te quitan el dinero cuando quieren!,"Tenía acumulado 30€ de cupones que me pasaban amigos y de la noche a la mañana me los quitan por ""no utilizarlos correctamente""",ES
943,False,,1,2015-06-25 23:11:16,Daaani!,Me siento estafado.,"Me siento estafado. Me han quitado TODO el crédito de mi cuenta por un problema que ellos mismos han creado (todavía estoy tratando de ver en qué parte de los términos y condiciones pone que no se puedan usar códigos de otras ciudades... ¿Y si voy a Londres y quiero usarla?).
Obviamente no todo mi crédito venía de ese tipo de códigos, sino que la gran mayoría provenían de haber conseguido que amigos míos se registraran y usaran la aplicación.
Además, para poner la guinda, compré hace poco un plan para cenar pero cuando llegamos al establecimiento resulta que estaba CERRADO, obligándonos a modificar nuestros planes y tener que buscar otro sitio rápido.
Fue una buena app mientras duró, pero de momento la desinstalaré.",ES
944,False,,1,2015-06-25 22:51:07,Debbievillalba,ESTAFADORES,Sin vergüenzas,ES
945,False,,1,2015-06-25 22:31:52,Jurssss,Estafa,"Una vergüenza que desaparezcan los códigos promocionales y que se cancelen los planes, incumpliendo sus propios términos de contrato. Nada recomendable.",ES
946,False,,1,2015-06-25 22:22:11,Kazluk,Nefastos e informales,"Te quitan el saldo y te anulan los planes comprados sin avisar
Los planes son mas caros que si vas por tu cuenta
No la recomiendo para nada",ES
947,False,,1,2015-06-25 22:14:13,Novoadesigns,#Feverestafa,Se pasan de listos! Mucho cuidado! Los planes son mas caros en la app que en el propio local,ES
948,False,,1,2015-06-25 21:59:08,Carlosalbertomartin87,Feverestafa,Me quitan todo el saldo y planes comprados diciendo que los codigos usados son fraudulentos!!!,ES
949,False,,1,2015-06-25 21:58:56,Chester46,Plan desaparecido,"Hoy hemos ido a un plan y cuando hemos llegado, nos han dicho que no les aparecía el plan porque fever hoy había cancelado muchos planes y nos hemos ido como hemos venido, sin cenar. Eso si con menos gasolina en el coche. Fever nada fiable #feverapesta",ES
950,False,,1,2015-06-25 21:57:38,Juan988,Cupones descuento falsos,"Tienen muchísimos fallos con los que es posible conseguir cupones( cambiando de país etc), al conseguirlos en lugar de asumir su error te bajan el
Contador a 0 € tengas lo
Que tengas. Es más rentable pagar la entrada normal que por esta aplicación. Buscad eventos y comprad desde otro lugar que asuman sus aciertos y sus fallos",ES
951,False,,1,2015-06-25 21:34:39,Darnesfc,Saldo desaparexido,Nos han quitado el saldo de golpe sin dan explicaciones.,ES
952,False,,1,2015-06-25 21:34:05,Pini8,Quitan el saldo,"Tenia 30€ de saldo y me lo han quitado.
Planes cancelados y planes que llegas y no saben ni de que les hablas
FATAL!!",ES
953,False,,1,2015-06-25 21:33:53,alearafa,De vergüenza,"Nos llaman estafadores por hacer algo que no reflejan en sus condiciones.
Desintalada ya!!",ES
954,False,,1,2015-06-25 21:33:30,jmmartos,Genial,Estafa no vale te dan saldo y luego te lo quitan,ES
955,False,,1,2015-06-25 21:31:53,ElisabetLope,No recomendada para nada,"Han borrado la cuenta a 0€. Supuestamente por uso fraudulento , no por usar codigos que ellos mismos dan y referidos. No cumplen con términos y condiciones. Y han cancelado planes afectando a establecimientos.",ES
956,False,,1,2015-06-25 21:26:11,OdioFEVER,APP NEFASTA,"No contabilizaba correctamente los códigos. Hacían cobros no autorizados. Lo ultimo ha sido quitar todos los créditos. 
BASURA.",ES
957,False,,1,2015-06-25 21:01:47,Resnonverna17,Feverestafa,En sus condiciones de uso no se contempla ni se especifica el uso de los cupones. Por ello me resulta pésima una aplicación que castiga a los usuarios por sus lagunas.,ES
958,False,,1,2015-06-25 20:55:17,laucsap3,Ladrones!!!,"Soy uno de los miles de afectados a los que nos han robado el crédito pagado, y se desdicen!!! No compréis nada, os cobrarán y nunca más sabréis!!",ES
959,False,,1,2015-06-25 20:41:31,Usuario Fever,ERROR APP,Nos dieron dinero de descuento y nos lo quitaron de la noche a la mañana. Cancelando planes ya comprados. No me fio de que lo vuelvan a hacer. La he desistalado.,ES
960,False,,5,2015-06-25 18:49:46,Antesmolabais,Fever sinverguenza,Devolverme mi dinero ladrones ! Q me jartao de mete codigo cambiando de ciudades pa q vengais ahora a quitarme eñ dinerito ! Feverestafadores yo creia en vosotros,ES
961,False,,1,2015-06-25 20:40:01,Lafarenco,Lamentable,"Deplorable la actuacion de estos individuos si pueden ser llamados así, despojando de unos pocos codigos promocionales a sus clientes la mayoria universitarios y por lo tanto con poco nivel adquisitivo por un supuesto uso fraudulento, de todas formas en algunos restaurantes hacian caso omiso a fever o en su defecto te trataban como a rata callejera. Vayanse a Valdemingomez escoria.",ES
962,False,,1,2015-06-25 20:34:28,Deycgjxdjcjxnskkhahc,Estafa,"Borran todos los cupones que consigues alegando que los has usado de manera fraudulenta, si no queréis perder tiempo no os bajéis la aplicacion. Penosa atencion a los usuarios.",ES
963,False,,1,2015-06-25 20:25:22,Felsuk,Estafa.,"Es una estafa de aplicación, te dan códigos para canjearlos y luego te los quitan diciéndote literalmente ""fraudulento"" por usarlos.",ES
964,False,,1,2015-06-25 20:24:56,josefu1992,desaparece dinero,"El dinero de los referidos a desaparecido de mi cuenta, estafa",ES
965,False,,1,2015-06-25 20:21:22,Sin notificaciones,Me han quitado mi saldo,"App muy mala que solo merecia la pena por los codigos de descuento, y ya ni eso me la descargue ayer con mis 5 euros por referido y me han quitado el saldo por presunto uso fraudulento porque ni siquiera me ha dado tiempo a comprar ningún plan, lo dicho una vergüenza de app desistalada",ES
966,False,,5,2015-06-23 08:13:37,analacaro,ANNAB64,"Utiliza este codigo ANNAB64
Y recibiras 5€ gratis al entrar a la cuenta que podras gastar en lo que quieras:)",ES
967,False,,1,2015-06-25 18:34:01,Manu Pérez,Mal,No se como se me ha borrado todo el dinero que tenía.,ES
968,False,,5,2015-06-22 15:01:58,ANTONIOG926,🎁5€ si escribes ANTONIOG926,Quieres 5€ en fever escribe ANTONIOG926,ES
969,False,,5,2015-06-20 09:47:11,Yerai Ballesteros,Muy buena aplicación,Me parece muy buena aplicación he enontrado bastantes buenos planes a buen precio recomiendo descargarla,ES
970,False,,1,2015-06-21 16:04:46,Roromler,No se abre!!!!,"Llevo varias semanas intentando abrir esta aplicación, pero siempre que intentó entrar por Facebook o Google me da error. A alguien más le ha pasado esto? Cómo lo habéis solucionado?",ES
971,False,,4,2015-06-21 10:49:42,CurrucucucuPaloma,5€ 👌,ESTEPHF1 💁,ES
972,False,,5,2015-06-19 18:22:36,Gmachetti,Me encanta!,"La app es super completa, tiene planes muy variados y consigues precios muy buenos para el cine.",ES
973,False,,5,2015-06-17 18:13:17,Adrian Castellet,Awesome,Me parece genial que exista una aplicación que me ayude a organizar mis planes en Madrid con mayor facilidad!,ES
974,False,,4,2015-06-17 18:43:07,Artesuburbano,Código: TAMARAN45,"Genial para salir gratis o más barato. Para nuevos usuarios, metiendo TAMARAN45 y después FEVERARTISTA tienes 10 euros gratis x)",ES
975,False,,5,2015-06-14 20:04:38,borss88,util para planes en tu ciudad,realmente util para planes dentro de tu ciudad si quieres ahorrar dinero.,ES
976,False,,1,2015-06-17 11:44:44,Chochouuuu,Buena por los códigos,"La App diseñada esta genial, se nota que metieron en ella 2M€. Los planes son más caros con fever que en el local. Se mantendrá mientras haya códigos de descuento, sin códigos será mejor groupon o letsbonus.",ES
977,False,,1,2015-06-17 07:16:17,Mikaela821,Ni la descarguen,Siempre lo mismo y tarda muchísimo,ES
978,False,,1,2015-06-15 17:45:03,Nuketown2,Me parece buena,Tiene muy buen contenido,ES
979,False,,4,2015-06-15 17:30:48,Acampo94,Bueno,Bueno,ES
980,False,,5,2015-06-14 18:44:59,ALVAROE23,Cupon 5€,Escribir ALVAROE23 para conseguir cupon de 5€,ES
981,False,,4,2015-06-14 19:22:17,Cm212,Primeros 5€,Introduce el CÓDIGO: CARLAM212 nada mas descargar la aplicación,ES
982,False,,5,2015-06-13 08:22:09,lilillloli,MUY BUENA APLICACIÓN,es tipo groupon pero mejorado! y mucho más práctico ya que hay gente que no tenemos impresora y se puede enseñar el móvil,ES
983,False,,5,2015-06-12 21:53:59,Pacorove,Magnifica apo,Muchos planes de todo tipo! De gran utilidad. 100% recomendada,ES
984,False,,5,2015-06-12 18:48:05,Patricia Ponce Martín,Excelente,"Me encanta, excelente app para saber los planes y todos muy baratos.",ES
985,False,,5,2015-06-10 14:52:12,Cacadepollo12,5€ gratiiis,Escribid RAFAA126 en canjear,ES
986,False,,1,2015-06-12 15:59:35,Patriciabrog,No funciona!!,"No me deja entrar... Hace tiempo la elimine aburrida de no poder entrar, hoy le he vuelto a dar una oportunidad y seguimos igual! 😠",ES
987,False,,5,2015-06-10 08:15:24,Carmina cordoba,Genial!,"Aplicación practica y fácil de usar, enganchadissimaaaa",ES
988,False,,1,2015-06-10 11:18:59,Jaime requejo,Swaag,Q asco de aplicacion,ES
989,False,,5,2015-06-09 11:09:16,IYTAAJWQ34,10€!!!!💥💥💥,Gana 10€ solo por este código! IYTAAJWQ34,ES
990,False,,4,2015-06-09 22:32:29,Djmarko22,Nuevos codigos a canjear!!!,"Gran actualizacion,y con nuevos codigos a canjear,si usas el mio nos dan 12€ a cada uno!! Mi codigo es.  FERNANDOL218",ES
991,False,,5,2015-06-07 23:06:14,Azafata155,Excelente,"Es una app genial, muy buenas ofertas!",ES
992,False,,5,2015-06-07 16:15:53,Olena Ryndina,Muy buena la App!,Muy buena App y muy buenos planes para ir con los colegas!,ES
993,False,,5,2015-06-07 15:41:08,Marychk,Fever,"Excelente aplicación, planes muy baratos! La recomiendo sin duda",ES
994,False,,5,2015-06-07 13:49:32,Jonathan García San Julián,¡Muy buena!,"Una aplicación destinada a los indecisos sobre algún plan, gran variedad de cosas donde seguro que encuentras algo entretenido en el que ocupar tu tiempo. 100% recomendable :)",ES
995,False,,5,2015-06-07 12:22:12,Bae*,Una aplicación de lo más útil,Muy buena App para poder hacer muy buenos planes con los colegas y precio para todas las carteras. La recomiendo!,ES
996,False,,5,2015-06-05 23:16:54,LorenaLara,Cenita GRATIS,Muy buena aplicación y muy práctica! Es tipo Groupon pero mejorado!!!,ES
997,False,,5,2015-06-05 22:59:35,Meriemlaarifi,Muy útil,Os la avinsejo es buenisima.,ES
998,False,,5,2015-06-05 20:54:51,Peo esto,PedroSM,Perfectos planes para tu ciudad,ES
999,False,,5,2015-06-05 20:50:12,Pedro S M,Buenos planes,Excelente app en tu ciudad,ES
1000,False,,5,2015-06-03 10:01:23,Yuhug1003,10€,Codigo en mayúsculas: AUXIP3,ES
1001,False,,3,2015-06-05 14:00:10,Rula26,RAQUELQ25 canjea 5€,Me gusta! Muchas opciones para disfrutar de tu ciudad.,ES
1002,False,,4,2015-06-03 20:44:21,SweetReko,Alicante.,Que pongan Alicante!,ES
1003,False,,4,2015-06-03 16:21:06,GONZALOI22,GONZALOI21,Con el cupón de descuento GONZALOI21 obtén 10€ gratis! Alucinante!,ES
1004,False,,5,2015-06-02 14:39:28,xdxdxdze,10 € gratis!!,Meter en codigos SANTIG31 para recibir10€!!!,ES
1005,False,,5,2015-05-30 13:55:06,Enru87,Imprescindible,"Usa el dinero acumulado para ir a eventos, comidas, etc. Sin gastar nada de tu bolsillo!!",ES
1006,False,,1,2015-05-31 21:16:52,Charvalencia,No funciona en iPhone 4s,En iPhone 4s al poner códigos de cupón refiere a que la app esta desactualizada. Una vergüenza,ES
1007,False,,4,2015-05-31 15:23:43,Pauetvlc,Códigos,PAUH2 pra recibir 5€ en códigos!,ES
1008,False,,1,2015-05-31 08:42:57,Yipanas,No me deja meterme ni con el gmail ni con el facebook,Me sale error,ES
1009,False,,4,2015-05-30 22:13:03,Ropugil,Buena manera de conocer sitios nuevos y degustarlos,Buena manera de conocer sitios nuevos y degustarlos,ES
1010,False,,5,2015-05-29 21:09:29,Xomarcg,Genial,Una aplicación genial para hacer planes,ES
1011,False,,4,2015-05-30 10:19:02,Luisgot,Código,LUISGOTP1 ponme y ganaremos los dos,ES
1012,False,,1,2015-05-30 09:02:21,meaburroooo,pues vaya..,"Menuda basura, no puedes filtrar busqueda i te pasas media hora buscando algo que no sea comida",ES
1013,False,,5,2015-05-29 19:41:32,Bea Carrero,Muy buena aplicacion,Esta muy bien la recomiendo para salir por sevilla.,ES
1014,False,,5,2015-05-29 19:07:11,David Chatarrero,Muy buena,"Gracias por esta pedazo de aplicación, estupendos planes a estupendos precios",ES
1015,False,,5,2015-05-29 14:33:24,denniscoello,Muy buena!,Es genial!,ES
1016,False,,5,2015-05-29 09:51:09,Abzueta,Malisimo el soporte de la app sin wifi,"Muy buena idea, una app que cuando le da la gana funcionar te da muchas opciones para planes en la ciudad! Además de los constantes cupones que ofrece! Pero al momento de hacer el login sin wifi es de las peores, no mantiene el registro del login y te obligan practicamente a conectarte con facebook (no tengo facebook y me parece mal que te obliguen)",ES
1017,False,,5,2015-05-28 22:56:53,David_4.7,Excelentes planes..,FEVER la mejor app para planes en Madrid muy buenos y sobretodo sus bonos y descuentos !,ES
1018,False,,5,2015-05-28 13:06:26,Lilisinmas,Genial,Es brutal,ES
1019,False,,1,2015-05-28 14:17:50,Krmeli,No me deja entrar,"Da fallo la aplicación nisiquiera puedo llegar a entrar, falloo",ES
1020,False,,5,2015-05-24 19:50:13,For7ez4,Muy práctica,App fantástica. Buenos planes y muy accesibles!,ES
1021,False,,5,2015-05-23 17:54:25,Mar sevilla,Me encanta,Tengo planes todos los días!,ES
1022,False,,4,2015-05-24 01:46:14,Rous78,5 € gratis,Hola buenas fever regala 5 € gratis al descargarte la aplicación con tan sólo meter en cupones de descuento azafata154 en mayúsculas y listo en segundos obtendrás los 5 € para gastarlos en el evento que quieras!,ES
1023,False,,5,2015-05-20 20:22:28,PelirrojaMadrid7,Es muy buena,"He ido a varios sitios a comer y siempre me voy con muy buena impresión, la recomiendo para ir a sitios nuevos y no caer en la rutina.",ES
1024,False,,4,2015-05-22 16:05:56,Jeanleso,Codigo,Utiliza el codigo JEANL31 y recives 5€ gratis,ES
1025,False,,5,2015-05-20 09:53:05,LUISMISB1,LUISMISB1,Introduce LUISMISB1 en los codigos de promocion FEVER y recibe 10 euros para gastar en lo que quieras.,ES
1026,False,,2,2015-05-20 13:24:39,rastruja,No funciona login en Facebook,La aplicación no se qué tal estará porque ni siquiera he conseguido hacer login,ES
1027,False,,5,2015-05-18 21:50:34,Miguel Frutos,"Alicante, ¡por favor!","Pude probar la aplicación en un viaje que hice a Madrid y la verdad es que era un lujo, muchísimos planes y a precios de escándalo. ¿Para cuándo en Alicante?",ES
1028,False,,2,2015-05-20 01:50:42,Alejandroserrano,No funciona,Buena aplicacion hasta la ultima actualizacion. Abres la app y se cierra a los pocos segundos. Espero k se arregle pronto,ES
1029,False,,5,2015-05-15 07:53:52,EduardoZen,Great,Great,ES
1030,False,,1,2015-05-18 18:08:48,Aglarwen,Bugg,"Con la nueva actualización, ahora cada vez que entro y quiero canjear un cupón de descuento, al seleccionar la pestaña se me sale automaticamente de la aplicación... Poniendose ella segundos antes de negro 👌",ES
1031,False,,4,2015-05-15 08:39:41,Mike Taison,Falta Zaragoza!,"Muy buena app, a Zaragoza le falta una aplicación de este tipo para la ciudad, cuando la vais a incluir?",ES
1032,False,,5,2015-05-14 16:05:45,Alenunsaa,Top,Aunque se podrían poner más planes,ES
1033,False,,5,2015-05-14 14:00:12,kinosm5,10€ DE REGALO EN LA APP,Codigo: RODRIGOJ2,ES
1034,False,,5,2015-05-11 19:23:47,X3R3Z,Recomendabre,"Esta genial...
No se como la usa tan poca gente....",ES
1035,False,,1,2015-05-12 14:17:25,EduArre,Sin optimización para iPhone 6.,"Instalado. Visto que no está optimizado para iPhone 6 y borrado ipso-facto. Alucino que casi un año después de la salida del último iPhone, cracks como éstos o los del Tenedor no tienen adaptadas sus aplicaciones. De risa.",ES
1036,False,,5,2015-05-11 14:35:31,miguelonnnn de mi alma,cupon descuento,introducid AZAFATA187 y os apareceran 5€,ES
1037,False,,5,2015-05-09 13:03:32,Yaiza_svb,Genial,"Está muy bien esta app, es súper útil. Muy buenos planes por poquito dinero. Muy recomendable",ES
1038,False,,1,2015-05-11 05:36:20,C- indignada,No me sirve para nada,"Hay muchos planes muy apetecibles pero jamás me deja apuntarme, no funciona el ""botón"" para apuntarse en lista o comprar un cupón, por lo que no me sirve de nada tenerla descargada",ES
1039,False,,1,2015-05-10 13:30:22,Marinssssssss,Fatal,Es un timo tengo 30 euros y no me deja gastarlos QUE DECEPCIÓN,ES
1040,False,,5,2015-05-09 11:49:52,Mng92bcn,Genial!,Muy útil!,ES
1041,False,,5,2015-05-09 11:49:29,Marialuque,Perfecta,Muy buena aplicacion!! De 10,ES
1042,False,,5,2015-05-09 11:16:48,Anitapain,Me encanta,Siempre tienes algo que hacer 🔝💯,ES
1043,False,,5,2015-05-09 10:22:46,IsaGómez,Entretenida y utilísima,La mejor aplicación de planes de ocio para Sevilla; y lo mejor de todo es que los planes son muy económicos!,ES
1044,False,,5,2015-05-09 07:11:56,Almu198331,Me encanta,Muchos planes y baratos😃,ES
1045,False,,5,2015-05-09 06:43:17,Israel Cuevas,Genial,Esta aplicación merece mucho la pena.,ES
1046,False,,5,2015-05-08 22:23:47,Javiolpa,Genial!!,"Es una aplicación genial, con una gran cantidad de planes y bastante bien de precio!!",ES
1047,False,,5,2015-05-08 21:24:23,Rrrbbbbi,Recomendada,Aplicacion que va a triunfar muy pronto! No te la puedes perder! Buenas ofertas siempre!,ES
1048,False,,5,2015-05-08 20:58:47,Sevilla-centro,Genialllll,Esta genial y además gratuita!,ES
1049,False,,5,2015-05-08 20:02:44,Christ2589,Mucho mejor que antes,"Ahora esta mucho mejor, la descargue hace tiempo y la borre pero ahora encuentro muchísimos planes que se acercan a mis gustos",ES
1050,False,,5,2015-05-05 14:27:35,Torilete,Descuento,TORILTT1 y consigue 5€ de descuento!!,ES
1051,False,,4,2015-05-06 17:46:40,Crisegon,Interesante,Pero falta Berlín!!!!,ES
1052,False,,4,2015-05-06 00:52:22,Squash_15,Bastante buena!,Os dejo aqui mi codigo por si otros no funcionan ^^,ES
1053,False,,5,2015-05-04 23:06:54,Cafe Moliere,Excepcional,La mejor app de planes y descuentos sin dudad,ES
1054,False,,5,2015-05-02 13:30:17,dsrdiego,Buenísima,Un montón de buenos planes diferentes,ES
1055,False,,4,2015-05-04 09:14:51,Aleexxxiua,Guay!,ALEXANDRAG117 os dará 5 euros de descuento,ES
1056,False,,3,2015-05-03 17:37:41,Miguescami,Tenerife yaa,5* cuando metan a s/c de tenerife,ES
1057,False,,5,2015-04-29 06:43:17,Grchugftijvfdgb,Nuevos sitios,Una buena forma de conocer diferentes lugares de tu ciudad din gastar mucho,ES
1058,False,,2,2015-05-01 11:51:10,Adrian benito,Queda por mejorar,"La idea esta bien, la aplicación es bastante comoda pero no tiene sentido que muestre planes a los que no puedes apuntarte porque no quedan entradas y tratandose de madrid, tampoco hay muchas posibilidades",ES
1059,False,,1,2015-04-25 18:57:55,Albita_,Decepcionada,"Decepciona. Para registrarte es obligatorio registrarte a través de una red social, no lo puedes hacer directamente con tus datos.",ES
1060,False,,5,2015-04-24 11:15:33,Killer13124235,Gran app,"Top donde las haya, llena de planes y novedades",ES
1061,False,,5,2015-04-21 10:46:28,paol89,Top,Aplicación top! Muy recomedable :),ES
1062,False,,5,2015-04-21 10:29:12,Paquito6969,Excelente,Gran app!!! Llena de actividades y novedades jeje,ES
1063,False,,5,2015-04-18 12:04:55,Jhonnyjj3,Excelente,Bien,ES
