,isEdited,developerResponse,rating,date,userName,title,review,country
398,False,,5,2017-08-31 16:06:38,Gorko4034,Muy bueno,El componente social brutal. Te mandan planes de cosas que desconocía y muy apetecibles para hacer en Madrid.,ES
399,False,,5,2017-08-29 09:46:59,Carolina igc,Fever como modo de vida,"La mejor app para comprar entradas de cines y festivales a un precio de alucine , además de lo cómodo que es llevarlas en el móvil y no tener que imprimirlas !",ES
400,False,,5,2017-08-28 14:23:11,Venus-242,Genial,Mucha variedad de planes en Sevilla y buen servicio por parte de la app.,ES
401,False,"{'id': 1054667, 'body': 'Hola Enuri,\n\nGracias por tu valoración :)\n\nNos hace muy feliz encontrar gente que disfruta de todos los planes que ofrecemos y de sus increíbles descuentos.\n\nNo dejes de seguirnos en las redes y permanece alerta a la app y a todos los cupones que vamos ofreciendo. Además, actualizamos planes todos los días. ¡No los dejes escapar!\n\nFacebook: www.facebook.com/FeverupES\nTwitter: twitter.com/feverapp\nInstagram: @feverup\n\n¡Gracias por usar Fever!\n\nUn saludo,', 'modified': '2017-08-19T18:06:46Z'}",5,2017-08-16 14:21:43,xowazoforevah,Gran App,Encuentro los mejores planes y siempre a buen precio!,ES
402,False,"{'id': 1054768, 'body': '¡Hola!\n\nGracias por tus cinco estrellazas ;)\n\nDesde Fever nos esforzamos cada día para dar al usuario el mejor trato del mundo, que es sin duda el que se merece.\n\n¡Y nos encanta!\n\nUn saludo,', 'modified': '2017-08-19T18:36:04Z'}",5,2017-08-16 08:56:15,Blue malva,Muy bien!,"Planes diferentes, originales y super bien de precio! Además un servicio de atención al cliente impecable!",ES
403,False,"{'id': 1071689, 'body': '¡Hola!\n\nGracias por tu valoración :)\n\nNos hace muy feliz saber que estás disfrutando de todos nuestros planes y de sus increíbles descuentos ;)\n\nNo dejes de seguirnos en las redes y permanece alerta a la app y a todos los cupones que vamos ofreciendo. Además, actualizamos planes todos los días. ¡No los dejes escapar!\n\nFacebook: www.facebook.com/FeverupES\nTwitter: twitter.com/feverapp\nInstagram: @feverup\n\n¡Gracias por usar Fever!', 'modified': '2017-08-22T05:14:51Z'}",5,2017-08-10 10:37:41,nakoosos,Buenos eventos a mejores precios,Se nota que se han puesto las pilas y han metido bastantes planes guapos. Keep working!!,ES
404,False,"{'id': 984996, 'body': '¡Hola!\n\nMuchas gracias por tus 5 estrellazas :)\n\nEn Fever trabajamos muy duro para llegar a todas vuestras necesidades e ir mejorando cada día. Muchas gracias por hacernos saber que estamos en el camino correcto.\n\nUn saludo,', 'modified': '2017-08-10T08:54:49Z'}",5,2017-08-08 15:42:49,Franklineting,Fever cuenta con las mejores alternativas de Madrid,100% Recomendado,ES
405,False,"{'id': 985034, 'body': '¡Hola!\n\nGracias por tu valoración :)\n\nRecuerda que tenemos campañas nuevas cada semana con las que conseguir cupones Fever es más que fácil ;)\n\n¡Gracias por usar Fever!\n\nUn saludo,', 'modified': '2017-08-10T08:57:26Z'}",5,2017-08-05 23:27:18,PaskalG,Grandes descuentos,La forma perfecta de hacer planes sin gastarte un dineral. Usando el crédito Fever consigues grandes descuentos en muchísimos planes,ES
406,False,"{'id': 925963, 'body': 'Gracias por tu valoración :)\n\nNos hace muy feliz encontrar gente como tú a la que le gusta Fever tanto como a nosotros...¡o más! \n\n¡Gracias por usar Fever!', 'modified': '2017-09-28T20:24:29Z'}",5,2017-07-27 14:59:04,MaikMadrid,Imprescindible,App imprescindible para la gente que le gusta probar cosas nuevas,ES
407,False,"{'id': 1071849, 'body': 'Hola Enuri,\n\nGracias por tus 5 estrellazas ;)\n\nNos hace muy feliz encontrar gente como tú a la que le gusta Fever tanto como a nosotros...¡o más!\n\nNo dejes de seguirnos en las redes y permanece alerta a la app y a todos los cupones que vamos ofreciendo. Además, actualizamos planes todos los días. ¡No los dejes escapar!\n\nFacebook: www.facebook.com/FeverupES\nTwitter: twitter.com/feverapp\nInstagram: @feverup\n\n¡Gracias por usar Fever!', 'modified': '2017-08-22T05:28:42Z'}",5,2017-07-20 15:15:08,Pumbavlc,La mejor app,Una app que siempre te da la mejor opción para pasar lo de 10,ES
408,False,"{'id': 925976, 'body': '¡Hola! \n\nSentimos mucho que pienses así :(\n\nSi necesitas que revisemos tu caso y te demos una atención más personalizada, escríbenos a hola@feverup.com.\n\n¡Esperamos tu email!\n\nUn saludo,', 'modified': '2017-09-28T20:24:29Z'}",1,2017-07-26 14:27:52,Maconde,Cuidado con las compras,"Les importa muy poco el cliente, solo quieren ganar:
1 - La primera ves que compras algo con una tarjeta se guarda de forma automática sin consultar, y como te equivoques en comprar o pinchar se te cobra y nunca te van a devolver el dinero, aunque por error compres el mismo plan la misma hora y el mismo, mismo valor, para ellos no es un error es que eres tonto y lo has comprado aposta y no te devuelven el dinero nunca.
2. Llamas al servicio técnico te dirán, aunque el error fuera de ellos o de la aplicación nunca jamás devuelven el valor.
Es una trampa va a lo k van por el dinero les importa muy poco si te gusta el o quieres otra opción, es imposible, te ofrecerán otras opciones para que lo disfrutes en 15 días, vamos cosa k para ellos en ese caso es una opción muy especial, restituir un valor k no es suyo y k el cliente ni lo ha disfrutado.
3 - A la hora de compra tener cuidado, no tenéis ninguna opción de revisar o una advertencia de k vas a comprar esto a aquello, se cobra de forma tan fácil y discreta y deja claro que no pierden la oportunidad a la hora de aprovechar los errores de los clientes.",ES
409,False,"{'id': 925983, 'body': 'Hola,\n\nQueremos que sepas que nos tomamos muy en serio las opiniones de los usuarios, y ya hemos transmitido tu petición al departamento de producto para que lo tengan en cuenta para futuras versiones de la app.\n\n¡Muchas gracias!', 'modified': '2017-09-28T20:24:29Z'}",4,2017-07-26 09:57:42,Crear alias 05,Buena app de planes-Aspectos a mejorar,"Es una app y posee muy buenos planes y variados, no obstante, entiendo que sería mejor si tuviera una sección en la que pudieras ""guardar"" de alguna forma los planes que te interesan para así poder reservar después sin tener que buscarlos nuevamente. También sería mejor si permitiera filtrar por rango de precio.",ES
410,False,"{'id': 1071883, 'body': '¡Hola!\n\nGracias por tu valoración :)\n\nTodos nuestros planes se actualizan cada día y con las nuevas versiones de la app han llegado aún más y con descuentos increíbles ;)\n\nAdemás, puedes afinar tu búsqueda utilizando los nuevos filtros a tu disposición ;)\n\n¿A qué esperas para disfrutar de todos ellos?\n\nUn saludo,', 'modified': '2017-08-22T05:31:39Z'}",5,2017-07-18 21:00:40,ivanhsrf,La mejor app para salir y cenar por tu ciudaf,Sin duda la mejor aplicacion para salir a conocer los mejores locales de tu ciudad a un precio muy economico,ES
411,False,"{'id': 1072077, 'body': '¡Hola!\n\nMuchas gracias por tus cinco estrellas :)\n\nNos encanta saber que, además de disfrutar de todos nuestros planes y de sus increíbles descuentos, hemos cumplido con nuestro más sagrado deber...¡tratar a nuestros usuarios cómo mejor sabemos!\n\nGracias por usar Fever.\n\nUn saludo,', 'modified': '2017-08-22T05:47:34Z'}",5,2017-07-14 15:06:23,Silvitxu_1,Atención personal excelente,"Se trata de una app para encontrar planes diversos a buen precio, y no sólo la app está genial, sino que si tienes cualquier problema te atienden al instante con mucha amabilidad. Así da gusto!",ES
412,False,,5,2017-06-03 11:45:08,MarinaZB,Estupendos,"Mi problema solucionado en menos de 25 minutos. Gestión rápida, súper amables y eficaces. ¡Muchas gracias!",ES
413,False,"{'id': 1430030, 'body': '¡Hola!\n\nNos encanta saber que hacemos bien nuestro trabajo y que podemos ofreceros soluciones a vuestros problemas ¡en un tiempo record! \n\nGracias por usar Fever :)\n\nUn saludo,', 'modified': '2017-10-04T16:08:53Z'}",5,2017-06-02 08:38:44,Jos3vk,Fever,Tuve un problema con una entrada y fueron rápidos y amables en darme una solución encantado con el soporte técnico de fever,ES
414,False,"{'id': 1422634, 'body': 'Hola Ana,\n\nGracias por tu valoración :)\n\nNos encanta encontrar soluciones para cada caso, a la mayor brevedad posible, y ayudaros con vuestros problemas poniéndonos siempre en vuestro lugar.\n\n¡Gracias por hacernos saber que cumplimos con nuestra misión!\n\nUn saludo,', 'modified': '2017-10-03T18:48:54Z'}",5,2017-05-31 12:04:05,AnaEstrada,Atención al cliente fantástica,He quedado muy satisfecha con la resolución del/la agente que me ha atendido. Han solucionado mi problema en menos de 1 hora. Muchas gracias!,ES
415,False,"{'id': 1429888, 'body': 'Hola,\n\nGracias por tu valoración :)\n\nNos hace muy feliz encontrar gente como tú a la que le gusta Fever tanto como a nosotros. No dejes de seguirnos en las redes y permanece alerta a la app y a todos los cupones que vamos ofreciendo. Además, actualizamos planes todos los días. ¡No los dejes escapar!\n\nFacebook: www.facebook.com/FeverupES\nTwitter: twitter.com/feverapp\nInstagram: @feverup\n\n¡Gracias por usar Fever!\n\nUn saludo,', 'modified': '2017-10-04T15:51:20Z'}",5,2017-05-26 12:19:55,Djvxxxx,Excelente,Muy buenos planes y ofertas siempre. Además de los cupones con descuentos que hacen frecuentemente. Recomendado,ES
416,False,"{'id': 1422601, 'body': '¡Hola!\n\nMuchísimas gracias por tu valoración :)\n\nNos hace muy feliz encontrar gente como tú a la que le gusta Fever tanto como a nosotros.\n\nNo dejes de seguirnos en las redes y permanece alerta a la app y a todos los cupones que vamos ofreciendo. Además, actualizamos planes todos los días. ¡No los dejes escapar!\n\nFacebook: www.facebook.com/FeverupES\nTwitter: twitter.com/feverapp\nInstagram: @feverup\n\n¡Gracias por usar Fever!\n\nUn saludo,', 'modified': '2017-10-03T18:43:36Z'}",5,2017-05-20 13:52:51,Vallecana82,Me encanta,La recomiendo muchísimo,ES
417,False,,5,2017-04-22 05:39:32,Javi 33,Gracias Fever,"Ante un error mío , he pedido ayuda vía chat de aplicación y se ha solucionado llegando a un acuerdo ... gracias",ES
418,False,,1,2017-03-15 11:49:21,Bsvanesa,Son 5€ no 20€ los que regalas,Son 5€ no 20€ los que regalas 🤔🙅🏽,ES
419,False,,1,2017-03-07 23:47:51,Alberto Muriana,Fever,La aplicacion es buena pero solo estan 10 ciudades en total y algunas no son españolas,ES
420,False,,5,2017-03-07 23:45:38,Jennengel09,CÓDIGO DESCUENTO 5€,Introduzca JENNIFERF251 recibirás 5€ descuento para tu compra !!!! 💪🏼💪🏼💪🏼,ES
421,False,,5,2017-03-05 22:08:59,Cas_bcn,Dinero gratis,"Introduce el cupón 
CRISTIANME1

Y consigue 5€ gratis",ES
422,False,,5,2017-02-04 11:40:42,Roger Edward,Muy buena,Excelente app!!!,ES
423,False,,4,2017-02-18 09:51:13,D4rk4nG3L xd,Kuro regalo 5,Meted en cupones KUROK1 y os llevais 5 euros,ES
424,False,,1,2017-02-16 00:26:56,Laanonima indignada,Granada tambien tiene que estar,"Que poca vergüenza que pongan tantos sitios, incluso de Andalucía y no sean capaz de poner la ciudad mas bonita de todas ""granada"" indignacion maxima.",ES
425,False,,5,2017-01-25 16:37:38,Elizuli,Descuentooooo,"Añadir a  cupones mi codigo y os regalan 5€ para compras!!! 

ELIZABETHA15",ES
426,False,,3,2017-01-29 09:33:59,Alexsart,ALEJANDROM1555,"Mi cupón regalo para todoos ALEJANDROM1555 !!!

 Estaa bastante bien...pero se cuelga alguna q otra Vez.",ES
427,False,,5,2017-01-12 09:30:01,Carlososososso1,Fever,La verdad que siempre ha ido bien y cuando he tenido algún problema me lo han solucionado rápido y bien,ES
428,False,,1,2017-01-14 20:29:38,Mujer decepcionada,Súper mal,He reservado un servicio y no se han puesto en contacto con la empresa. Cuando he llegado no sabían absolutamente nada de la reserva y no lo he podido realizar cuando estaba establecido,ES
429,False,,1,2017-01-14 10:05:39,Josefina24252740,SE ME CIERRA LA APP,"Cuando entro en el apartado de cultura y moda se me cierra la app, me ha pasado 3 veces seguidas",ES
430,False,,1,2017-01-13 15:13:03,Anabel la guerra,Salta,Se me sigue saliendo solo la aplicación,ES
431,False,,1,2017-01-12 20:04:45,Bula ara,Gijon para cuando ?,Una ciudad con tantos eventos no se os puede escapar,ES
432,False,,5,2017-01-09 13:13:06,Raule8,DESCUENTO,"Si queréis conseguir 5 euros gratis
RAULM912",ES
433,False,,5,2016-12-10 15:16:00,josemanugf,Genial!,Fabuloso y excepcional servicio de atención al cliente!,ES
434,False,,4,2016-12-27 10:50:07,Guille44,Me gusta y es util,Si queréis tener 5€ de mi parte poned GUILLERMOM395. La app es genial para no aburrirte nunca,ES
435,False,,1,2016-12-18 14:09:10,Ybybybybo,Peligro con equivocarte,"La app no está mal pero ojo! Si te equivocas al hacer una compra JAMÁS te van a devolver el dinero, aunque les contactes a los 30 segundos de haberla hecho!, te dicen que la compra ha sido voluntaria y bla bla bla...
Vamos, excusas baratas! No lo devuelven porque no les da la gana. El soporte de la app de pena en ese sentido, parecen robots. Muy descontento con el trato que dan a sus clientes.",ES
436,False,,5,2016-12-06 09:54:27,Qwertyhjklñ,Descuento Activo 5€,ESTRELLAG10 está en activo :),ES
437,False,,4,2016-12-02 17:17:21,EDGARG111,canjea mi codigo te daran 5€,esta muy bien,ES
438,False,,4,2016-11-30 06:41:23,Saraesme,5€ GRATIIS,"SARAJP2
Canjea mi códigoo 😊 La app está genial para coger ideas!!",ES
439,False,,4,2016-11-27 09:30:41,Ximal,La app está bien...,Pero que no os engañe Victor9444 os dará 5€ como los demás! 😜,ES
440,False,,5,2016-11-12 11:42:58,flowiii11,buena,muy buena app para hacer planes!! utilizad mi codigo para tener dinero!! FLOWERP2,ES
441,False,,4,2016-11-26 03:34:41,Carla Riera,5€ gratis,Si canjeas mi código: CARLAR298 te llevas 5€ GRATIS!!,ES
442,False,,4,2016-11-13 18:00:16,Are_corolla,Muy buena pero...,"Muy buena aplicación para ahorrarse unos euros,pero debería de poderse hablar con los asistentes al evento y sería perfecta.Le doy 4 estrellas de 5 porque cuando se pueda chatear con los asistentes será perfecta.
Espero que mejoren eso y gracias y un saludo!!!!",ES
443,False,,1,2016-11-13 16:38:51,Eddddddgghhjj,Fever estafa no la bajes,Se compro un plan de dos entradas de cine por 20 euros sin dar validar porque guardaron mi tarjeta d crédito. Cuidado con que se guarde la tarjeta de crédito!!,ES
444,False,,5,2016-10-30 11:44:04,Fever original,CODIGO DESCUENTO: AZIZIC1,20 euros para ti  SOLO HASTA 11/01/2017,ES
445,False,,1,2016-11-08 21:10:14,manubacu93,Se lo han cargado!!,Penosa organización no saben ni que hacer con los cupones ahora todo cuesta dinero!! para eso pago en efectivo!!,ES
446,False,"{'id': 1072182, 'body': '¡Hola!\n\nCada plan admite un máximo de descuento con cada cupón, pero no tiene por qué ser 5€, puede ser más alto :)\n\nPor otro lado, los tickets de cine tienen una rebaja media de alrededor de 5€.\n\nEsperamos que sigas disfrutando de todo lo que tenemos que ofrecerte ;)\n\nUn saludo,', 'modified': '2017-08-22T06:07:45Z'}",2,2016-11-04 07:22:40,Lapsos,Se han cargado los cupones,"Ahora ya solo te deja usar cupones con valor máximo de 5€, y uno por compra. Se acaban de cargar el mecanismo con esta última actualización, además de poner precios para el cine sin ningún tipo de ventaja. Muy decepcionado.",ES
447,False,,4,2016-11-03 17:43:57,Natma27,Cupon!! 5€,KAROLH20 y te regalan 5€ 😜,ES
448,False,,1,2016-11-02 14:10:21,Sergio Sánchez Sastre,Problema,No se puede comprar tickets la aplicacion se cierra y no aparecen los planes,ES
449,False,,4,2016-11-02 09:55:42,Ibrokero,Me encanta,"Me encanta esta aplicación, porque gracias a ella, conozco sitios nuevos. Llevo poco tiempo viviendo en Sevilla y con esta aplicación compro los ticket de restaurantes para obligarnos a mi marido y a mí a salir por la capital. Sin embargo hay que leer la letra pequeña, ya que si intentas devolver algún ticket, no te devuelven el dinero. Por todo lo demás, me encanta",ES
450,False,,3,2016-11-01 19:08:21,Eh jálale,Cupon,Utilizar mi cupón de bienvenida ESTHERA389,ES
451,False,,5,2016-10-25 23:52:54,MiguelRL,"Hasta 50€ de Descuentos, Cupon!!","Una app imprescindible!!! Con montones de planes a precios insuperables!!! Aquí os dejo un codigo de 5€ para empezar a disfrutar de la app: MIGUELR412
¡Disfrutadlo!",ES
452,False,,5,2016-10-24 15:22:33,Guillermo Vázquez,Genial!,"5€ gratis con el codigo: GUILLERMOF97 

App genial para hacer planes baratos y entretenidos, Muy recomendable",ES
453,False,,5,2016-10-23 23:46:28,EVAC742,Me gusta esta app!!!,"Chic@s este es código:EVAC742,entren y reciban crédito de mi parte!!!",ES
454,False,,5,2016-10-13 18:14:54,Fever organisation,20€ PARA TODOS TUS PLANES,"Todos los codigos dados no funcionan ya que nunca antes habiamos ofrecido nada parecido hasta este mes de octubre en el cual hemos sacado una nueva promocion. REGALAMOS 20€ a todas las personas que se registren por primera vez en fever con el codigo PATRICIAC860.
Pd: solo se daran los 20€ si no ha sido registrado antes
DEVERDAD FUNCIONA",ES
455,False,,4,2016-10-19 13:27:33,OscarWeek,Consigue 20€ gratis!,Fantastica app! Consigue 20€ intoduciendo OSCARL401 en promociones y consigue el dinero en l app al instante!,ES
456,False,,4,2016-10-16 23:24:04,SASHAM94,Wooow,"Consigue 5€ gratis poniendo en el cupón de descuento SASHAM94. 
No dan más nunca en este cupón!!",ES
457,False,,1,2016-10-16 19:31:59,Csl767,Falla,No puedo entrar en el perfil porque se reinicia.,ES
458,False,,5,2016-10-05 19:10:23,Mimaitek,Buena aplicación,Busca planes rápido. Usa mi código. MAITEO32,ES
459,False,,1,2016-10-10 16:17:13,Fluzotron,Falla falla falla,"A intentar validar en taquilla desde la app se me cierra al entrar en mis tickets, todo esto con el stress de estar en la fila del teatro, seguire comprando en atrapalo que es mucho mas fiable",ES
460,False,,5,2016-09-29 22:09:02,Nane Hab,Los mejores planes,"Siempre que piensas que el día está acabado, fever me echa una mano para levantar la noche, planes, descuentos, locales.. App TOP.",ES
461,False,,1,2016-09-30 10:19:36,ljl78,Harto de registros,"Como muchas apps, te pide que te logees por Facebook o Google+. Los que no tenemos ninguna (y no queremos), no tenemos derecho a utilizarla. Pues peor para ellos.",ES
462,False,,5,2016-09-16 16:38:03,Gatxik,Mil planes!,"Un montón de planes con descuentos! Perfecto para conocer sitios chulos de las ciudades! Restaurantes, entradas de cine, discotecas... Si queréis 5€ de descuento, podéis usar el codigo GARAZIG8 y ganamos todos! :)",ES
463,False,,5,2016-09-11 16:27:10,TrichiSpain,Genial!!,TRIZIAM1 😜💚,ES
464,False,,4,2016-09-15 07:51:33,M.Meshant,5€ de descuento= MMARIAM5855,Copia mi codigo y tendras 5€ de descuento en tus planes,ES
465,False,,1,2016-09-14 13:23:28,bestcaraudi,Decepcionado,Esta aplicación no es otra cosa q ventas de entradas para diferentes locales reservas en restaurantes etc etc no ofrece algo fuera de común diferente etc detrás de la aplicación ay alguna empresa q va a comisión con los locales donde vende los servicios me esperaba q sea algo diferente.,ES
466,False,,5,2016-08-30 10:23:47,EDDYF1,Gran aplicación!!,Gran aplicación y buenos planes. Recibid 5€ para gastar en lo que queráis poniendo el código: EDDYF1,ES
467,False,,1,2016-09-11 13:38:56,Ebezmar,La última actualización no funciona,No funciona la actualización,ES
468,False,,1,2016-09-09 15:04:36,Jadeandrealof,Gracias x marginar a los iPhone 4,"Como ahora necesitas un iOS 8 para actualizar, ya no me sirve de nada. Muchas gracias!!! Por una app guai que tenia...",ES
469,False,,5,2016-08-13 08:25:38,Noe_e,Genial!,Tiene planes super buenos y muy bien de precio!! Si queréis 5€ de descuento introducid mi codigo NOEMIM276.,ES
470,False,,1,2016-08-26 17:11:51,JaimeS79,Pésima,"Una aplicación que te obligue a dar permiso a acceder a tu cuenta de correo y todo lo que ello implica no está dentro de las cosas que permitiré de una aplicación. 
 
Un total abuso! Qué es esto!!",ES
471,False,,1,2016-08-22 18:26:10,Lionflap,Otra mas...,Otra app que te obliga a entrar con facebook o google+. Bravo!,ES
472,False,,1,2016-08-18 20:01:26,Frank984,No va,Cuando la abro me pide que la actualice y no puedo pq tengo un iPhone 4 así que me j...,ES
473,False,,5,2016-08-06 23:28:50,javito2121,Genial,Los mejores planes al mejor precio! Encantado con la app y sobre todo con la atención.,ES
474,False,,3,2016-08-11 17:52:32,Sergi26,Actualizacion,"No puedo actualizar a iOS 8 por mi modelo de teléfono. Al descargar la app me sale un mensaje para descargar una versión anterior a la actual para así poder utilizarla pero, cada vez que abro la aplicación me sale el mensaje de actualizar a la última versión, sin opción a cerrar el mensaje haciendo imposible usar la app... Me gusta la app, pero hasta que no se solucione esto me despido.",ES
475,False,,5,2016-08-05 17:58:46,Fergmolina,App llena de posibilidades,App llena de posibilidades de ocio. Merece la pena.,ES
476,False,,5,2016-07-23 11:03:51,Diegovillaaaa,Imprescindible,"Una app perfecta con ofertas y planes increíbles, y una atención al cliente inmejorable. Pocas apps hay así.",ES
477,False,,1,2016-08-03 07:32:27,Sansaoctop,Inútil,"Todo lo de los códigos está muy bien, pero en VLC esta app no vale para nada. Propone siempre los mismos planes y tampoco aporta facilidades... Al menos en mi ciudad está mal organizada",ES
478,False,,4,2016-07-27 14:33:53,Pau207,Buenas fotos,"Fotos bien seleccionadas, aun no he reservado a través de la app pero dan ganas de ir a cualquier restaurante! No se si existe pero se puede llegar a valorar el plan o poner tu opinion sobre la experiencia de la gente que ya lo ha contratado? Gracias!",ES
479,False,,4,2016-07-22 16:13:00,Rasty96,Empezando,"Me gustaria que hubiera comentarios  en la app,de los lugares a los que ya a ido gente.
Codigo:DIEGOM792",ES
480,False,,5,2016-07-20 09:21:06,KEVINM522,CUPON DE REGALO,Brutal aplicacion! Si quereis cupon aqui el mio KEVINM522,ES
481,False,,5,2016-07-13 16:04:01,cristiruar26,DESCUENTOOO,Aqui teneis 5€ de descuento! CRISTINAR1462,ES
482,False,,4,2016-07-18 19:33:28,Los negocios siguen,Añadir mas ciudades,"Para la proxima version estaria bien ampliar las cuidades. Podriais incluir La Coruña en los planes fever, hay muchas empresas de hosteleria, cultura, espectaculos...
Mis 5 estrellas serán para entonces.
Gracias a los creadores y personal de mantenimiento y mejora de esta app!",ES
483,False,,2,2016-07-16 10:09:33,iDaniMoy,No la instaléis es una ESTAFA !!,"Ya no se puede comprar nada con saldo fever , te hacen pagar , menuda vergüenza de aplicación. Se han metido en el selecto club de sacar todo el dinero posible a sus clientes , clientes que le hemos dado su fama",ES
484,False,,5,2016-07-13 06:47:44,Kgferrero,Me encanta,Una App llena de sorpresas apenas empiezo a usarla pero la experiencia es muy buena,ES
485,False,,5,2016-07-12 11:13:23,JIAR_LTbiz,Muy útil para aprovechar y descubrir,"La verdad es que no pensé que iba a utilizar esta App como lo estoy haciendo. Muy práctica y sencilla. Además de propuestas interesantes, también ofrece descuentos o mejores condiciones. Ok!",ES
486,False,,5,2016-07-11 12:09:01,Jmp9292,Estafa,Estafa me quitaron todo el dinero que tenia en la cuenta y ahora no se pueden comprar planes con saldo,ES
487,False,,5,2016-07-10 11:22:41,Ryanfrodin,La mejor App para hacer planes,"Os regalo 7€ 

Poned : RYANC84
Y luego VIP",ES
488,False,,5,2016-07-05 14:38:33,StefaniiaMM,Genial!,Descuento de 5€ en cualquier plan STEFANIAM33 👏🏼👏🏼👏🏼,ES
489,False,,5,2016-07-05 13:41:39,Rafacastro_3,Buena app,"Podría mejorar la aplicación, poner más planes.",ES
490,False,,5,2016-06-26 21:51:09,annaaltee,ANNAB593,USA EL CÓDIGO ANNAB593 Y GANA 5€ para gastarlo en lo que más te apetezca!,ES
491,False,,5,2016-06-21 10:49:52,Frank - King in the North,Amazing App,Una App genial fácil de usar a la que siempre recurro cuando  necesito una idea de ocio que realmente cool,ES
492,False,,5,2016-06-17 15:25:32,Saray Porompompero,"Dinero gratis, Genial! ⭐️⭐️⭐️⭐️⭐️","AIULJMRY881
Si accedes a la app y pones mi codigo los dos recibiremos 5€ para gastar en gastronomia, fiesta, ocio, deportes,...
Esta App es genial, no te la pierdas!",ES
493,False,,1,2016-06-18 17:40:52,13carlosdo,Privacidad,"Bajada y borrada, no entiendo una aplicacion que tenga que funcionar metiendo tu cuenta de google o facebook",ES
494,False,,5,2016-05-27 14:11:12,Tuytuytuuuuu,Good,👍🏼,ES
495,False,,5,2016-05-07 16:58:52,Flipper124,Genial,👍👍👍👍,ES
496,False,,5,2016-05-05 14:29:28,Telete 09,💃,🔝🔝,ES
497,False,,1,2016-05-07 11:14:24,Mblamar93,Estafa,"No lo recomiendo, te quitan dinero de tu cuenta bancaria aunque tengas créditos fever... Y después nadie soluciona nada... Muy rapido para quitar dinero pero muy lento para solucionar problemas que ellos mismos causan",ES
498,False,,5,2016-05-03 12:26:55,SRMITTER,Fever,Si queréis obtener un bono de 5€ para cualquier plan que queráis poner el siguiente CODIGO : JAVIERP628,ES
499,False,,5,2016-04-30 18:44:44,Luiste69,Fever,Una gran aplicación con grandes descuentos! La recomiendo,ES
500,False,,5,2016-04-21 07:07:38,sanzas3,Recibiras 5€ de bienvenida.,"Al introducir este cupón
  JAVIERS892 recibirás 5€ de bienvenida que podrás utilizar en cualquier plan!",ES
